{
  "inventoryVersion": 2,
  "coreVersion": "2026.10.06.1",
  "buildTimestampUtc": "2026-10-06T12:10:01.3611574+00:00",
  "releaseType": "stable",
  "items": [
    {
      "name": "Portable Tools Root",
      "path": "Tools\\Portable",
      "sourceUrl": "",
      "version": "workspace-snapshot",
      "managed": false,
      "checksum": "",
      "verified": false,
      "source_trust": "manual",
      "notes": "Curated portable tool collection. Inventory root only; child categories remain manually maintained.",
      "downloadMode": "ReviewFirst",
      "actionLabel": "Review First",
      "managedReason": "Manual workspace root only; child binaries are not catalog-verified.",
      "verificationMode": "manual-root"
    },
    {
      "name": "Portable Disk Tools",
      "path": "Tools\\Portable\\Disk",
      "sourceUrl": "",
      "version": "mixed",
      "managed": false,
      "checksum": "",
      "verified": false,
      "source_trust": "manual",
      "notes": "Manual third-party disk utilities.",
      "downloadMode": "ReviewFirst",
      "actionLabel": "Review First",
      "managedReason": "Manual workspace root only; child binaries are not catalog-verified.",
      "verificationMode": "manual-root"
    },
    {
      "name": "Portable Hardware Tools",
      "path": "Tools\\Portable\\Hardware",
      "sourceUrl": "",
      "version": "mixed",
      "managed": false,
      "checksum": "",
      "verified": false,
      "source_trust": "manual",
      "notes": "Manual third-party hardware diagnostics.",
      "downloadMode": "ReviewFirst",
      "actionLabel": "Review First",
      "managedReason": "Manual workspace root only; child binaries are not catalog-verified.",
      "verificationMode": "manual-root"
    },
    {
      "name": "Portable Network Tools",
      "path": "Tools\\Portable\\Network",
      "sourceUrl": "",
      "version": "mixed",
      "managed": false,
      "checksum": "",
      "verified": false,
      "source_trust": "manual",
      "notes": "Manual third-party networking utilities.",
      "downloadMode": "ReviewFirst",
      "actionLabel": "Review First",
      "managedReason": "Manual workspace root only; child binaries are not catalog-verified.",
      "verificationMode": "manual-root"
    },
    {
      "name": "Portable System Tools",
      "path": "Tools\\Portable\\System",
      "sourceUrl": "",
      "version": "mixed",
      "managed": false,
      "checksum": "",
      "verified": false,
      "source_trust": "manual",
      "notes": "Manual third-party system utilities.",
      "downloadMode": "ReviewFirst",
      "actionLabel": "Review First",
      "managedReason": "Manual workspace root only; child binaries are not catalog-verified.",
      "verificationMode": "manual-root"
    },
    {
      "name": "Portable Remote Tools",
      "path": "Tools\\Portable\\Remote",
      "sourceUrl": "",
      "version": "mixed",
      "managed": false,
      "checksum": "",
      "verified": false,
      "source_trust": "manual",
      "notes": "Manual third-party remote support tools.",
      "downloadMode": "ReviewFirst",
      "actionLabel": "Review First",
      "managedReason": "Manual workspace root only; child binaries are not catalog-verified.",
      "verificationMode": "manual-root"
    },
    {
      "name": "Portable USB Tools",
      "path": "Tools\\Portable\\USB",
      "sourceUrl": "",
      "version": "mixed",
      "managed": false,
      "checksum": "",
      "verified": false,
      "source_trust": "manual",
      "notes": "Manual USB creation and flashing utilities.",
      "downloadMode": "ReviewFirst",
      "actionLabel": "Review First",
      "managedReason": "Manual workspace root only; child binaries are not catalog-verified.",
      "verificationMode": "manual-root"
    },
    {
      "name": "Portable GPU Tools",
      "path": "Tools\\Portable\\GPU",
      "sourceUrl": "",
      "version": "mixed",
      "managed": false,
      "checksum": "",
      "verified": false,
      "source_trust": "manual",
      "notes": "Manual GPU cleanup and install utilities.",
      "downloadMode": "ReviewFirst",
      "actionLabel": "Review First",
      "managedReason": "Manual workspace root only; child binaries are not catalog-verified.",
      "verificationMode": "manual-root"
    },
    {
      "name": "Portable Security Tools",
      "path": "Tools\\Portable\\Security",
      "sourceUrl": "",
      "version": "mixed",
      "managed": false,
      "checksum": "",
      "verified": false,
      "source_trust": "manual",
      "notes": "Manual portable security utilities.",
      "downloadMode": "ReviewFirst",
      "actionLabel": "Review First",
      "managedReason": "Manual workspace root only; child binaries are not catalog-verified.",
      "verificationMode": "manual-root"
    },
    {
      "name": "Drivers Root",
      "path": "Drivers",
      "sourceUrl": "",
      "version": "workspace-snapshot",
      "managed": false,
      "checksum": "",
      "verified": false,
      "source_trust": "manual",
      "notes": "Offline driver stash; folders are manually curated.",
      "downloadMode": "ReviewFirst",
      "actionLabel": "Review First",
      "managedReason": "Manual workspace root only; child binaries are not catalog-verified.",
      "verificationMode": "manual-root"
    },
    {
      "name": "Driver Audio Staging",
      "path": "Drivers\\Audio",
      "sourceUrl": "",
      "version": "mixed",
      "managed": false,
      "checksum": "",
      "verified": false,
      "source_trust": "manual",
      "notes": "Manual audio driver staging.",
      "downloadMode": "ReviewFirst",
      "actionLabel": "Review First",
      "managedReason": "Manual workspace root only; child binaries are not catalog-verified.",
      "verificationMode": "manual-root"
    },
    {
      "name": "Driver Bluetooth Staging",
      "path": "Drivers\\Bluetooth",
      "sourceUrl": "",
      "version": "mixed",
      "managed": false,
      "checksum": "",
      "verified": false,
      "source_trust": "manual",
      "notes": "Manual Bluetooth driver staging.",
      "downloadMode": "ReviewFirst",
      "actionLabel": "Review First",
      "managedReason": "Manual workspace root only; child binaries are not catalog-verified.",
      "verificationMode": "manual-root"
    },
    {
      "name": "Driver Chipset Staging",
      "path": "Drivers\\Chipset",
      "sourceUrl": "",
      "version": "mixed",
      "managed": false,
      "checksum": "",
      "verified": false,
      "source_trust": "manual",
      "notes": "Manual chipset driver staging.",
      "downloadMode": "ReviewFirst",
      "actionLabel": "Review First",
      "managedReason": "Manual workspace root only; child binaries are not catalog-verified.",
      "verificationMode": "manual-root"
    },
    {
      "name": "Driver Graphics Staging",
      "path": "Drivers\\Graphics",
      "sourceUrl": "",
      "version": "mixed",
      "managed": false,
      "checksum": "",
      "verified": false,
      "source_trust": "manual",
      "notes": "Manual graphics driver staging.",
      "downloadMode": "ReviewFirst",
      "actionLabel": "Review First",
      "managedReason": "Manual workspace root only; child binaries are not catalog-verified.",
      "verificationMode": "manual-root"
    },
    {
      "name": "Driver Input Staging",
      "path": "Drivers\\Input",
      "sourceUrl": "",
      "version": "mixed",
      "managed": false,
      "checksum": "",
      "verified": false,
      "source_trust": "manual",
      "notes": "Manual input driver staging.",
      "downloadMode": "ReviewFirst",
      "actionLabel": "Review First",
      "managedReason": "Manual workspace root only; child binaries are not catalog-verified.",
      "verificationMode": "manual-root"
    },
    {
      "name": "Driver Network Staging",
      "path": "Drivers\\Network",
      "sourceUrl": "",
      "version": "mixed",
      "managed": false,
      "checksum": "",
      "verified": false,
      "source_trust": "manual",
      "notes": "Manual wired network driver staging.",
      "downloadMode": "ReviewFirst",
      "actionLabel": "Review First",
      "managedReason": "Manual workspace root only; child binaries are not catalog-verified.",
      "verificationMode": "manual-root"
    },
    {
      "name": "Driver Storage Staging",
      "path": "Drivers\\Storage",
      "sourceUrl": "",
      "version": "mixed",
      "managed": false,
      "checksum": "",
      "verified": false,
      "source_trust": "manual",
      "notes": "Manual storage and RAID driver staging.",
      "downloadMode": "ReviewFirst",
      "actionLabel": "Review First",
      "managedReason": "Manual workspace root only; child binaries are not catalog-verified.",
      "verificationMode": "manual-root"
    },
    {
      "name": "Driver Wireless Staging",
      "path": "Drivers\\Wireless",
      "sourceUrl": "",
      "version": "mixed",
      "managed": false,
      "checksum": "",
      "verified": false,
      "source_trust": "manual",
      "notes": "Manual Wi-Fi driver staging.",
      "downloadMode": "ReviewFirst",
      "actionLabel": "Review First",
      "managedReason": "Manual workspace root only; child binaries are not catalog-verified.",
      "verificationMode": "manual-root"
    },
    {
      "name": "Realtek Audio Drivers Shortcut",
      "path": "Drivers\\Audio\\DOWNLOAD - Realtek Audio Drivers.url",
      "sourceUrl": "https://www.realtek.com/en/downloads",
      "version": "n/a",
      "managed": true,
      "checksum": "",
      "verified": true,
      "source_trust": "official",
      "notes": "Managed official page shortcut; not a managed file download.",
      "downloadMode": "OEMSpecific",
      "actionLabel": "Vendor Portal",
      "managedReason": "Verified official page shortcut only. Driver/firmware selection remains manual and vendor/model-specific.",
      "verificationMode": "managed-page-shortcut"
    },
    {